{"$id":"https://knowledge-os.local/schemas/m25-prompt-contract-v1.schema.json","$schema":"https://json-schema.org/draft/2020-12/schema","additionalProperties":false,"properties":{"ignore_embedded_instructions":{"const":true},"json_only_output":{"const":true},"prompt_contract_sha256":{"pattern":"^[a-f0-9]{64}$","type":"string"},"prompt_id":{"minLength":1,"type":"string"},"schema_version":{"const":"knowledge-engine-m25-prompt-contract/v1"},"secrets_must_not_be_returned":{"const":true},"source_text_untrusted":{"const":true},"system_template":{"maxLength":12000,"minLength":1,"type":"string"},"user_template":{"maxLength":12000,"minLength":1,"type":"string"},"version":{"minLength":1,"type":"string"}},"required":["schema_version","prompt_id","version","system_template","user_template","source_text_untrusted","ignore_embedded_instructions","secrets_must_not_be_returned","json_only_output","prompt_contract_sha256"],"title":"m25-prompt-contract-v1","type":"object"}
